{
  "$schema": "https://json-schema.org/draft/2020-12/schema",
  "title": "connector credential check request, v0",
  "description": "POST /v0/contributions/connector/check_credential, since Plugin API 0.3. Check that the source accepts the credential, without fetching items. Used for Connector Health.",
  "type": "object",
  "additionalProperties": false,
  "required": [
    "invocation_id",
    "contribution",
    "organization_id",
    "configuration",
    "connector",
    "credential",
    "now"
  ],
  "properties": {
    "invocation_id": {
      "type": "string",
      "minLength": 1,
      "maxLength": 128,
      "description": "Unique per attempt; correlate logs with it."
    },
    "contribution": {
      "const": "connector"
    },
    "organization_id": {
      "type": "string",
      "minLength": 1
    },
    "configuration": {
      "type": "object",
      "description": "The plugin configuration the installer supplies, valid against configuration.schema."
    },
    "connector": {
      "$ref": "connector-fetch-request.schema.json#/properties/connector"
    },
    "credential": {
      "$ref": "connector-fetch-request.schema.json#/properties/credential"
    },
    "now": {
      "$ref": "connector-fetch-request.schema.json#/properties/now"
    }
  }
}
