{
  "invocation_id": "inv-feed-check-1",
  "contribution": "connector",
  "organization_id": "org-1",
  "configuration": {},
  "connector": {"instance_id": "connector-7", "kind": "feed", "config": {"feed_url": "https://feeds.example.com/news"}},
  "credential": {"token": "test-token-0000"},
  "now": "2026-09-29T09:00:00Z"
}
